{
  "version": 1,
  "currency": "PLN",
  "timezone": "Europe/Warsaw",
  "taxRuleSets": [{"validFrom": null, "validTo": null, "rules": [{"id": "VAT", "type": "PERCENTAGE", "appliesToKinds": ["ENERGY_PURCHASE"], "rate": "0", "base": "CURRENT_SUBTOTAL"}]}],
  "billingCycles": [
    {
      "validFrom": null,
      "validTo": "2026-07-01T00:00:00+02:00",
      "anchor": "2026-01-15",
      "length": 1,
      "unit": "MONTH"
    },
    {
      "validFrom": "2026-07-01T00:00:00+02:00",
      "validTo": null,
      "anchor": "2026-07-01",
      "length": 1,
      "unit": "MONTH"
    }
  ],
  "periods": [
    {
      "validFrom": null,
      "validTo": null,
      "components": [
        {
          "id": "energy",
          "kind": "ENERGY_PURCHASE",
          "category": "ENERGY",
          "taxTreatment": {"included": []},
          "quantity": {
            "type": "ACTIVE_ENERGY_IMPORT"
          },
          "selector": {
            "type": "WEEKLY_SCHEDULE",
            "timezone": "Europe/Warsaw",
            "rules": [
              {
                "zone": "Z1",
                "days": ["MON", "TUE", "WED", "THU", "FRI", "SAT", "SUN"],
                "from": "00:00",
                "to": "24:00"
              }
            ]
          },
          "rate": {
            "type": "ZONED",
            "rates": {
              "Z1": "2"
            },
            "unit": "PLN/kWh"
          }
        },
        {
          "id": "billing-fee",
          "kind": "SUPPLIER_FIXED",
          "category": "SERVICE",
          "taxTreatment": {"included": []},
          "quantity": {
            "type": "PERIOD",
            "period": "BILLING_PERIOD",
            "prorate": false
          },
          "rate": {
            "type": "CONSTANT",
            "value": "7",
            "unit": "PLN/period"
          }
        }
      ]
    }
  ]
}
