{
  "version": 1,
  "currency": "PLN",
  "timezone": "Europe/Warsaw",
  "taxRuleSets": [{"validFrom": null, "validTo": null, "rules": [{"id": "VAT", "type": "PERCENTAGE", "appliesToKinds": ["UNUSED"], "rate": "0.23", "base": "CURRENT_SUBTOTAL"}]}],
  "billingCycle": {
    "anchor": "2026-01-15",
    "length": 1,
    "unit": "MONTH"
  },
  "periods": [
    {
      "validFrom": "2026-01-01T00:00:00+01:00",
      "validTo": null,
      "components": [
        {
          "id": "energy-purchase",
          "kind": "ENERGY_PURCHASE",
          "category": "ENERGY",
          "taxTreatment": {"included": []},
          "quantity": {
            "type": "ACTIVE_ENERGY_IMPORT"
          },
          "rate": {
            "type": "CONSTANT",
            "value": "0.50",
            "unit": "PLN/kWh"
          }
        },
        {
          "id": "distribution-variable",
          "kind": "DISTRIBUTION_VARIABLE",
          "category": "NETWORK",
          "taxTreatment": {"included": []},
          "quantity": {
            "type": "ACTIVE_ENERGY_IMPORT"
          },
          "rate": {
            "type": "CONSTANT",
            "value": "0.30",
            "unit": "PLN/kWh"
          }
        },
        {
          "id": "distribution-fixed",
          "kind": "DISTRIBUTION_FIXED",
          "category": "NETWORK",
          "taxTreatment": {"included": []},
          "quantity": {
            "type": "PERIOD",
            "period": "MONTH",
            "prorate": false
          },
          "rate": {
            "type": "CONSTANT",
            "value": "1.20",
            "unit": "PLN/month"
          }
        }
      ]
    }
  ]
}
