{
  "version": 1,
  "currency": "PLN",
  "timezone": "Europe/Warsaw",
  "taxRuleSets": [{"validFrom": null, "validTo": null, "rules": [{"id": "VAT", "type": "PERCENTAGE", "appliesToKinds": ["ENERGY_PURCHASE"], "rate": "0", "base": "CURRENT_SUBTOTAL"}]}],
  "periods": [
    {
      "validFrom": "2026-01-01T00:00:00+01:00",
      "validTo": null,
      "components": [
        {
          "id": "energy-purchase",
          "kind": "ENERGY_PURCHASE",
          "category": "ENERGY",
          "taxTreatment": {"included": []},
          "quantity": {"type": "ACTIVE_ENERGY_IMPORT"},
          "rate": {"type": "CONSTANT", "value": "0.50", "unit": "PLN/kWh"}
        },
        {
          "id": "distribution-variable",
          "kind": "DISTRIBUTION_VARIABLE",
          "category": "NETWORK",
          "taxTreatment": {"included": []},
          "quantity": {"type": "ACTIVE_ENERGY_IMPORT"},
          "selector": {
            "type": "REFERENCE",
            "source": "PL.PSE.PDGSZ",
            "mapping": {"0": "S1", "1": "S2", "2": "S3", "3": "S4"}
          },
          "rate": {
            "type": "ZONED",
            "rates": {"S1": "0.10", "S2": "0.20", "S3": "0.50", "S4": "2.00"},
            "unit": "PLN/kWh"
          }
        }
      ]
    }
  ]
}
