{
  "version": 1,
  "currency": "PLN",
  "timezone": "Europe/Warsaw",
  "taxRuleSets": [{"validFrom": null, "validTo": null, "rules": [{"id": "VAT", "type": "PERCENTAGE", "appliesToKinds": ["UNUSED"], "rate": "0.23", "base": "CURRENT_SUBTOTAL"}]}],
  "periods": [
    {
      "validFrom": "2026-01-01T00:00:00+01:00",
      "validTo": null,
      "components": [
        {
          "id": "energy",
          "kind": "ENERGY_PURCHASE",
          "category": "ENERGY",
          "taxTreatment": {"included": []},
          "quantity": {
            "type": "ACTIVE_ENERGY_IMPORT",
            "strategy": "IMPORT_MINUS_EXPORT_CAP_ZERO",
            "periodInMinutes": 60
          },
          "rate": {
            "type": "CONSTANT",
            "value": "1.00",
            "unit": "PLN/kWh"
          }
        },
        {
          "id": "distribution-variable",
          "kind": "DISTRIBUTION_VARIABLE",
          "category": "NETWORK",
          "taxTreatment": {"included": []},
          "quantity": {
            "type": "ACTIVE_ENERGY_IMPORT"
          },
          "rate": {
            "type": "CONSTANT",
            "value": "1.00",
            "unit": "PLN/kWh"
          }
        }
      ]
    }
  ]
}
