{
  "version": 1,
  "currency": "PLN",
  "timezone": "Europe/Warsaw",
  "taxRuleSets": [{"validFrom": null, "validTo": null, "rules": [{"id": "VAT", "type": "PERCENTAGE", "appliesToKinds": ["ENERGY_PURCHASE"], "rate": "0", "base": "CURRENT_SUBTOTAL"}]}],
  "billingCycles": [
    {
      "validFrom": null,
      "validTo": "2026-01-02T10:30:00+01:00",
      "anchor": "2026-01-01",
      "length": 1,
      "unit": "MONTH"
    },
    {
      "validFrom": "2026-01-02T10:30:00+01:00",
      "validTo": null,
      "anchor": "2026-01-02",
      "length": 1,
      "unit": "MONTH"
    }
  ],
  "periods": [
    {
      "validFrom": "2026-01-01T00:00:00+01:00",
      "validTo": null,
      "components": [
        {
          "id": "energy",
          "kind": "ENERGY_PURCHASE",
          "category": "ENERGY",
          "taxTreatment": {"included": []},
          "quantity": {
            "type": "ACTIVE_ENERGY_IMPORT",
            "strategy": "IMPORT_MINUS_EXPORT_CAP_ZERO",
            "periodInMinutes": 60
          },
          "rate": {
            "type": "CONSTANT",
            "value": "1"
          }
        }
      ]
    }
  ]
}
