{
  "version": 1,
  "currency": "PLN",
  "timezone": "Europe/Warsaw",
  "taxRuleSets": [{"validFrom": null, "validTo": null, "rules": [{"id": "VAT", "type": "PERCENTAGE", "appliesToKinds": ["ENERGY_PURCHASE"], "rate": "0", "base": "CURRENT_SUBTOTAL"}]}],
  "periods": [
    {
      "validFrom": "2026-01-01T00:00:00+01:00",
      "validTo": null,
      "components": [
        {
          "id": "energy-purchase",
          "kind": "ENERGY_PURCHASE",
          "category": "ENERGY",
          "taxTreatment": {"included": []},
          "quantity": {"type": "ACTIVE_ENERGY_IMPORT"},
          "rate": {"type": "CONSTANT", "value": "0.50", "unit": "PLN/kWh"}
        },
        {
          "id": "distribution-variable",
          "kind": "DISTRIBUTION_VARIABLE",
          "category": "NETWORK",
          "taxTreatment": {"included": []},
          "quantity": {"type": "ACTIVE_ENERGY_IMPORT"},
          "selector": {
            "type": "WEEKLY_SCHEDULE",
            "timezone": "Europe/Warsaw",
            "rules": [
              {
                "zone": "NIGHT",
                "days": ["MON", "TUE", "WED", "THU", "FRI", "SAT", "SUN"],
                "time_ranges": [
                  {"from": "22:00", "to": "06:00"},
                  {"from": "13:00", "to": "15:00"}
                ]
              },
              {
                "zone": "DAY",
                "days": ["MON", "TUE", "WED", "THU", "FRI", "SAT", "SUN"],
                "time_ranges": [
                  {"from": "06:00", "to": "13:00"},
                  {"from": "15:00", "to": "22:00"}
                ]
              }
            ]
          },
          "rate": {
            "type": "ZONED",
            "rates": {"DAY": "0.32", "NIGHT": "0.14"},
            "unit": "PLN/kWh"
          }
        }
      ]
    }
  ]
}
