{
  "version": 1,
  "currency": "PLN",
  "timezone": "Europe/Warsaw",
  "taxRuleSets": [{"validFrom": null, "validTo": null, "rules": [{"id": "VAT", "type": "PERCENTAGE", "appliesToKinds": ["ENERGY_PURCHASE"], "rate": "0", "base": "CURRENT_SUBTOTAL"}]}],
  "periods": [
    {
      "validFrom": "2026-01-01T00:00:00+01:00",
      "validTo": null,
      "components": [
        {
          "id": "energy-purchase",
          "kind": "ENERGY_PURCHASE",
          "category": "ENERGY",
          "taxTreatment": {"included": []},
          "quantity": {"type": "ACTIVE_ENERGY_IMPORT"},
          "rate": {"type": "CONSTANT", "value": "0.50", "unit": "PLN/kWh"}
        },
        {
          "id": "distribution-variable",
          "kind": "DISTRIBUTION_VARIABLE",
          "category": "NETWORK",
          "taxTreatment": {"included": []},
          "quantity": {"type": "ACTIVE_ENERGY_IMPORT"},
          "selector": {
            "type": "WEEKLY_SCHEDULE",
            "timezone": "Europe/Warsaw",
            "calendar": "PL_PUBLIC_HOLIDAYS",
            "seasons": [
              {"id": "SUMMER", "from": "--04-01", "to": "--10-01"},
              {"id": "WINTER", "from": "--10-01", "to": "--04-01"}
            ],
            "rules": [
              {
                "zone": "OFF_PEAK",
                "days": ["HOLIDAY"],
                "season": "*",
                "priority": 100,
                "time_ranges": [{"from": "00:00", "to": "24:00"}]
              },
              {
                "zone": "OFF_PEAK",
                "days": ["SAT", "SUN"],
                "season": "*",
                "priority": 200,
                "time_ranges": [{"from": "00:00", "to": "24:00"}]
              },
              {
                "zone": "OFF_PEAK",
                "days": ["MON", "TUE", "WED", "THU", "FRI"],
                "season": "SUMMER",
                "time_ranges": [
                  {"from": "22:00", "to": "07:00"},
                  {"from": "13:00", "to": "19:00"}
                ]
              },
              {
                "zone": "MORNING_PEAK",
                "days": ["MON", "TUE", "WED", "THU", "FRI"],
                "season": "SUMMER",
                "time_ranges": [{"from": "07:00", "to": "13:00"}]
              },
              {
                "zone": "AFTERNOON_PEAK",
                "days": ["MON", "TUE", "WED", "THU", "FRI"],
                "season": "SUMMER",
                "time_ranges": [{"from": "19:00", "to": "22:00"}]
              },
              {
                "zone": "OFF_PEAK",
                "days": ["MON", "TUE", "WED", "THU", "FRI"],
                "season": "WINTER",
                "time_ranges": [
                  {"from": "21:00", "to": "07:00"},
                  {"from": "13:00", "to": "16:00"}
                ]
              },
              {
                "zone": "MORNING_PEAK",
                "days": ["MON", "TUE", "WED", "THU", "FRI"],
                "season": "WINTER",
                "time_ranges": [{"from": "07:00", "to": "13:00"}]
              },
              {
                "zone": "AFTERNOON_PEAK",
                "days": ["MON", "TUE", "WED", "THU", "FRI"],
                "season": "WINTER",
                "time_ranges": [{"from": "16:00", "to": "21:00"}]
              }
            ]
          },
          "rate": {
            "type": "ZONED",
            "rates": {"MORNING_PEAK": "0.20", "AFTERNOON_PEAK": "0.35", "OFF_PEAK": "0.10"},
            "unit": "PLN/kWh"
          }
        }
      ]
    }
  ]
}
